Id,Fecha,Tweet,Usuario,Clasificación
5402,6/16/2022, Señor Elon Musk ayude a nuestro refugio de perritos desamparados   folded_hands  por favor  folded_hands   paw_prints  dog  paw_prints  folded_hands  red_heart  Somos de El Salvador  folded_hands  ,Somosngeles1,Neutro
5427,6/16/2022,Elon Musk es lo que una persona idiota piensa que es una persona inteligente,Erlemmer,Negativo
5430,6/16/2022,"Se espera que Elon #Musk confirme su deseo de ser dueño de #Twitter Inc. cuando hable con los empleados de la empresa de redes sociales mañana jueves, según una persona familiarizada con el asunto. ",L_G_R_R,Neutro
5436,6/16/2022,"best red social, saludos en la cola Elon Musk #MiAniversarioDeTwitter ",gonsi01,Neutro
5437,6/16/2022,AMAZON QUIERE ANIQUILAR A ELON MUSK Y A TESLA CON ESTE ENORME PLAN fire   via ,RABestConstruc1,Neutro
5145,6/16/2022,"    Lo de los satélites simplemente dijo que no considera que sea una buena solución, que para el es mejor la fibra óptica. Alex le comentó que debería considerar los satelites de star link de Elon Musk. Petro dijo que lo evaluaria.",Juansoul94gmai1,Neutro
5150,6/16/2022,"  Pero a quién vas a mantener tú, muerto de hambre? Si con poco no has cotizao en tu vida y te las vas dando aquí de Elon Musk. Vaya friki de verdad..  rolling_on_the_floor_laughing  rolling_on_the_floor_laughing ",alonsomlg,Neutro
5153,6/16/2022, Me encanto!!!! Y Quien es Elon Musk  thinking_face  thinking_face  thinking_face  ,MalejaFlorez16,Positivo
5155,6/16/2022, No tendrías ese problema si se cumple tu sueño/pesadilla de Elon Musk jajajajaja  face_with_tears_of_joy  face_with_tears_of_joy  face_with_tears_of_joy ,kikerzk,Neutro
5157,6/16/2022,  Realmente crees que nosotros lo vamos hacer? Esto se lo deben estar vendiendo a Elon Musk. Además que más ruido que los que había cuando la base estaba en operaciones?,Estadistarebeld,Neutro
5175,6/16/2022,"Según Elon Musk, Rivian y Lucid Motors van directos a la bancarrota  face_with_open_mouth ",periodismomotor,Neutro
5186,6/16/2022, Elon Musk no es dueño de twitter.,MarioTern13,Negativo
5188,6/16/2022,Elon Musk dijo que acabaría de inmediato con la propaganda molestosa que sale en Twitter y lo mas que sale es propaganda :/,losrios1994,Negativo
5193,6/16/2022,Y ahora viene lo bueno con Elon Musk ,neirajavier,Positivo
5195,6/16/2022,Se ve como algo que plantearía Elon Musk ,comitatenseocc,Neutro
5223,6/16/2022," Elon Musk va a tener mucho trabajo con las influencer subvencionadas por ministerios fascistas. 
Estáis dejando una sociedad de vagos, cobardes y mimados que no veas",Obolomix,Neutro
5229,6/16/2022,Elon Musk ha pagado millones por ver esto ,AntonioSm05,Neutro
5231,6/16/2022," Pero tranquilas, que desde que Elon Musk compro Twitter, regreso la libertad de expresión porque le devolvió la cuenta a Trump",DVag1na,Negativo
5247,6/16/2022,"   Esto le pega a Elon Musk. Después de inventar los túneles de metro, pero mal, ahora toca inventar un vehículo que circula en la superficie sobre una vía, pero mal. ",TheGoOse,Negativo
5251,6/16/2022,  En esto hecho de menos el punto de visto de Elon Musk donde prioriza los avances a los lanzamientos casi super seguros. SpaceX hace que la aventura espacial sea divertida cada día entre lo que comparten y lo que lanzan. Buenos momentos tenemos para disfrutarlo ;),simtoken,Positivo
5258,6/16/2022,"Elon Musk cree que Rivian y Lucid, dos de las competidoras de Tesla, están en camino a la bancarrota  ",ArkelMR,Neutro
5268,6/16/2022,"Elon Musk se salió con la suya: Starship podrá ir a Marte
",Ambitocom,Neutro
5282,6/16/2022," Majare Carmen, quien te crees con tantos likes? Elon musk?",iamaaronleiva,Positivo
5291,6/16/2022,"  ya se camarada, a mi también me tienen harta las propagandas, en especial la de los paneles solares de Elon Musk que salen hasta en la sopa, gracias por el dato, ya veré si me acerco al canal de CNN",veronicaaponte,Negativo
5304,6/16/2022,Comparto mbti con elon musk lloré ,holakazuha,Neutro
5314,6/16/2022,"    Caballero, quién es Elon Musk?!!  eyes  Pone una palabra y tiene miles de me gusta! face_with_tears_of_joy  face_with_tears_of_joy  face_with_tears_of_joy ",jacquesoto01,Positivo
5315,6/16/2022,"El magnate ya había advertido sobre el recorte del 10% de su personal ante posible recesión económica.
",conciertoradio,Negativo
5317,6/16/2022,"    No autorizo que circule mi imagen con tremenda cara de tristeza

NO AUTORIZO Elon Musk.",zatarain_lore,Negativo
5324,6/16/2022,"     Hombre, ni el hombre más inteligente del mundo sabe de todo, ni Elon Musk se lo juro que llega a saber de todo, pero es mejor ser humano y reconocerlo a intentar quedar bien. Buena noche.",HaroldF97,Positivo
5327,6/16/2022, elon musk tbn en nuestra theycel era,esteceleste_,Neutro
5348,6/16/2022,Elon Musk da su primer voto a los republicanos y vaticina su apoyo a DeSantis para las presidenciales del 2024  via ,dyc2012,Neutro
5350,6/16/2022,Elon Musk cuestiona el continuo y evidente sesgo ideológico en Twitter ,Romulo140352,Neutro
5353,6/16/2022,"  No deje afuera al que putea todos los días a Elon Musk , el pluriamigo ",fdondeestas,Neutro
5355,6/16/2022,"Ey, ese internet del Elon Musk esta bien caro… vas a tener que empeñar el tesla a la larga  face_with_tears_of_joy ",AnthonyGonSud,Negativo
5364,6/16/2022,Yo en qué fregado momento le di seguir al Elon Musk? Jajajaaja Da fuck?!  thinking_face  Yo creo que él se auto siguió,Des_souvenirs_,Negativo
5366,6/16/2022, Hoy Elon Musk no es nadie al lado de uno,MarvinRK22,Negativo
5382,6/16/2022,De acuerdo Elon Musk  ,ReguloSalasA,Positivo
5386,6/16/2022,#ElonMusk acusó a la SEC de socavar su derecho constitucional a la libertad de expresión y de utilizar el decreto para lanzar :investigaciones interminables e ilimitadas de su discurso”. ,lajornadaonline,Negativo
5144,6/16/2022, que tiene de malo elon musk? anxious_face_with_sweat ,ianvelazcoo,Neutro
5164,6/16/2022,    Pues abandona España hacia tu paraíso Americano. Ahí todos los autónomos se convierten en Elon Musk.,boulman9,Neutro
5185,6/16/2022," Está en su blog, a la espera de que Elon Musk arregle esto. Déjele un mensajito, que se lo agradecerá.
",FrayJosepho,Positivo
5190,6/16/2022,Elon Musk diz que Starship estará pronta para decolar em julho #OlharDigital ,olhardigital,Neutro
5196,6/16/2022, el point es que frikys que se quieren sentir inteligentes y sigue a Elon musk sigan siendo imbéciles sjsnsks,CiberMonke,Negativo
5245,6/16/2022,Ni por la libertad de expresión ni por la información veraz. Lo que quiere conseguir Elon Musk en tuiter es introducir el gotelé en este país.,sukarra2,Neutro
5278,6/16/2022,":Cuando algo es lo suficientemente importante, lo haces incluso cuando las probabilidades no están a tu favor”: Elon Musk #marketingdigital",menualdia,Positivo
5309,6/16/2022, Y qué tal con James Franco y elon musk ,brokenmind10,Neutro
5336,6/16/2022,"  Ignore todo lo que diga AMLO y MORENA.

Ya no tardan en decir que van a lanzar un cohete a Jupiter que va a ser más veloz que el de Elon Musk y que va a estar listo para la semana que entra.",guillu,Positivo
5360,6/16/2022,"Encontré un bot que sigue los viajes en avión de Elon Musk y déjenme decirles que la huella de carbono de ese señor está cabrona. Y además obvio son vuelos privados, no crean que comerciales.",Dana_Corres,Negativo
5361,6/16/2022, nao por favor ja me imagino vestida de satelite bem elon musk,stereomai,Neutro
5388,6/16/2022,"Cuántos miles de millones de dólares perdieron Elon Musk, Jeff Bezos y Mark Zuckerberg en lo que va del año  vía  Diario de Santiago",radio_santiago,Neutro
5397,6/16/2022,"Elon Musk's Twitter: Jessica González, Co-CEO, Free Press on CNN (4/25/2...  via ",LiLSilverJ,Neutro
5398,6/16/2022," 'Superintelligence: Paths, Dangers, Strategies' de Nick Bostrom

Recomendado por Elon Musk y Bill Gates, este texto del filósofo sueco es uno que nos advierte y recomienda que vayamos con cautela si hablamos de IA.

",Mil90,Neutro
5404,6/16/2022,"El día de hoy te presentamos #ÓrbitaTECH.
Elon Musk se reunirá por primera vez con empleados de Twitter.
Más info en: ",OrbitaMXOnline,Neutro
5412,6/16/2022,el día que deje de gastar plata en pelotudeces voy a ser elon musk,Nico_galarzaa,Positivo
5414,6/16/2022," ¿Ventilador? Joder, no tengo ni que fuera Elon Musk.",MrToldos,Neutro
5433,6/16/2022," No es por el vestido,es por la impotencia de que una vez más,el dinero pueda comprarlo todo y saltarse las reglas y normas de conservación de algo histórico. Me parece tan injusto e inmoral como Elon musk haciendo trabajar días enteros sin dormir a gente por el viaje lunar.",cleotonkin10,Negativo
5442,6/16/2022,  Sir Elon Musk ,Yeeeeeeeeeeet11,Positivo
5448,6/16/2022,  Amo a elon musk,boichi_w,Positivo
5143,6/16/2022, nunca se han cuestionado las cosas que promete Elon Musk? La mayoria son ridiculas. Solo hagan matematicas y analizen los planes. En verdad creo que Elon es el con-man mas exitoso de la historia. Solo analizen lo que en verdad se llevaria cumplir sus planes.,xtscarface,Positivo
5156,6/16/2022,   Si si. Fue la culpa del imperio y de Elon Musk. Tranquilo corruptito defiende a tus jefes maleantes. Es la única forma que un mediocre como tú puede tener un trabajo,kilodec0,Negativo
5163,6/16/2022, elon musk acabou contigo,zzpedroca,Negativo
5168,6/16/2022,Cinco declaraciones de Elon Musk que causaron polémica (+video).-  ,ALnaviocom,Negativo
5178,6/16/2022,Y si elon musk es un caballo de troya que busca dividir a los republicanos de cara al 2024 y dejar por fuera a Donald Trump en sus intereses de volver a la presidencia? ,RafaFebres,Neutro
5182,6/16/2022,"EEUU. Elon Musk apoya a uno de los posibles candidatos republicanos a la Presidencia en 2024, el católico y provida Ron DeSantis via  ",carolusaurelius,Neutro
5200,6/16/2022, Tu salud va por delante. Hasta que Elon Musk adquiera totalmente el control sobre la plataforma debemos mantener un perfil bajo.,Masc_Generico,Negativo
5211,6/16/2022, Podria ser un proyecto de elon musk,Irethis,Positivo
5216,6/16/2022,"Elon Musk dice que la diferencia entre que Tesla 'valga mucho o prácticamente cero' depende de si consigue la conducción autónoma, que lleva prometiendo desde 2015. ",BIEspana,Neutro
5228,6/16/2022,"¿Te acuerdas de Tumblr? El híbrido de red social y blog está resurgiendo, y no es por Elon Musk ",fuprisa,Neutro
5249,6/16/2022,Elon Musk manifestó su simpatía por uno de los posibles candidatos republicanos a la Presidencia en 2024 ,infobaemexico,Neutro
5252,6/16/2022, Que el gif sea encima de Elon Hueloarancio Musk es una maravilla,Albert0mate,Neutro
5256,6/16/2022,"El surrealismo de la noche fue tomar unos chupitos con Kerem y con Marcelo a la vez, solo faltaba Elon Musk ahi",cepedaoficial,Neutro
5264,6/16/2022,     Si como con Elon musk por eso le llama a sus hijos parásitos porque así va a conseguir que trabaje en su causa,mineofyours,Negativo
5273,6/16/2022," Por supuesto que tiene sentido, solo la gente desprecia el argumento por ser Dalas, pero si eso mismo lo menciona Elon Musk por ejemplo, lo ven como una innovación de la ciencia.",lozanofefi,Positivo
5283,6/16/2022, Me.parece qué Elon Musk no puede ser presidente porque no nació en USA.,cuba_pi,Neutro
5299,6/16/2022, Ni Elon Musk les hace nada. Ellos vacilan la vida en la sombra. ,Ares_holycross,Positivo
5306,6/16/2022,Y por fin Elon Musk va a comprar Twitter?,rubensyanes,Neutro
5308,6/16/2022,No mamen 12 redes sociales activas? Ni el mismísimo don Patrón Elon Musk llega a pavonearse de esa manera.,emiry_junkiie,Negativo
5320,6/16/2022,"Elon Musk votó esta semana por Mayra Flores.

Ella es la primera congresista estadounidense nacida en México.

Mayra es Republicana Y CATÓLICA. 

En donde ganó había sido un distrito Demócrata durante 40 años.

Los progres han de estar parados de pestañas. ",PacooGarcia,Positivo
5321,6/16/2022, apoyada por Elon Musk,Lagare7hk,Neutro
5330,6/16/2022,"Quien es más pesado, Dalas o Elon Musk? ",PazoAlexandre,Negativo
5466,6/16/2022,"#Mundo | El multimillonario Elon Musk dijo que votará por los republicamos :por primera vez: y que Ron DeSantis, gobernador de Florida, tiene :más posibilidades de ganar: ",DLasAmericas,Neutro
5478,6/15/2022, Sr. Elon Musk quiero comentar que está bien la idea de colonizar Marte y eh inclusive totalidad del Universo pero hay que saber que para colonizar nunca debemos abandonar nuestra procedencia Terráqueo. Logística más decir que aquí un español dice que hay déficit de O z8 ¡Gracias!,Pensariout,Neutro
5484,6/15/2022, Jajaja justo de eso hablaba con mis hermanos hace unos meses... Elon Musk es Afroamericano en toda regla jajaja,Hares892,Neutro
5487,6/15/2022,"Una reseña de cómo es el internet de starlink de Elon Musk 

",Leo_Tuitero,Neutro
5490,6/15/2022," Dios mío, Twitter me recomienda esto? En serio? No puedo esperar a que Elon Musk tome el control",leia39632525,Positivo
5524,6/15/2022," si, porque yo soy dueño de twitter y mandé a elon musk a que te la quitara smiling_face_with_horns  face_with_tears_of_joy ",royalnevergiv10,Neutro
5530,6/15/2022,Me puede decir alguien que hace el Dalas diciéndole a Elon Musk que no tenga más hijos porque son unos parásitos y debería gastar su tiempo en hacer a la gente inmortal y no eso? ,mineofyours,Positivo
5567,6/15/2022,"Elon Musk va a dejarse 40 millones en esta mierda, enhorabuena retrasado 1st_place_medal  ",albertofdezz__,Negativo
5572,6/15/2022,Elon Musk compró Twitter para esto: ,crisrdz7,Neutro
5590,6/15/2022,"El magnate Elon Musk ya había advertido sobre el recorte del 10% de su personal ante posible recesión económica.
",conciertoradio,Neutro
5596,6/15/2022,"Las 500 personas más ricas del mundo han perdido un total combinado de 1.4 billones de dólares este año, incluidos 206,000 millones de dólares solo del lunes, con multimillonarios como Chang Peng Zhao, Elon Musk y Jeff Bezos registrando las mayores pérdidas ",elceo__,Neutro
5608,6/15/2022,Elon musk pagó 44 de los grandes por esto ,hugomendez99,Neutro
5612,6/15/2022,Elon Musk votó por Mayra Flores. Es Q y además ganó. Mamita. ,JulianRooUS,Neutro
5624,6/15/2022,"Una fila de luces se verá en el cielo y Elon Musk no tiene nada que ver: los detalles  face_with_monocle 
 ",elsolonline,Neutro
5628,6/15/2022,"Tras Elon Musk admitir que votaría por Ron DeSantis, éste contesta agradeciendo el apoyo de los afroamericanos. ",PrimeroSpain,Positivo
5644,6/15/2022,Todo el showcito de Elon Musk tiene que ver con las elecciones de 2024 y su apuesta por los republicanos. ,Raugust_White,Neutro
5646,6/15/2022,"El CEO de Tesla, Elon Musk, dice que se inclina por respaldar al gobernador de Florida, Ron DeSantis, en la carrera presidencial de 2024, la última señal de una inclinación pro-republicana del hombre más rico del mundo
",elceo__,Neutro
5655,6/15/2022,"Estoy de acuerdo con esto, pero es así en la mayoría de los casos, si no sos una Greta Thunberg o un Gandhi, sos un Elon Musk, Bill Gates, Steve Jobs, han colaborado un montón con la vida, pero, el dinero es parte esencial de ese poder ",oma1980,Neutro
5668,6/15/2022,Elon Musk y trabajadores de Twitter se reunirán para aclarar dudas sobre la venta ,ElNucleoRocks,Neutro
5673,6/15/2022,Elon Musk cree que Rivian y Lucid están en camino a la bancarrota ,TdiColombia,Neutro
5690,6/15/2022,"Es para festejar el voto de Elon Musk (el emprendedor más rico del mundo) al PartidoRepublicano. Se recuerda a radicales :zurdos:, :centristas: y :galeritas: que el 1er partido que fundó el creador d la UCR se llamó PartidoRepublicano en homenaje a tal viejo gran partido de USA. ",StefanWugner,Positivo
5460,6/16/2022,Quiero anunciarle al país que en mi meteórico ascenso como divo de Twitter jamas ¡JAMÁS! tuve que acostarme con Elon Musk,JackDeLaConcha,Negativo
5499,6/15/2022,"Elon Musk ahí te habla Bill Gates  upside-down_face 
Si lo dices porque compre Twitter...  ",tolucanoticias,Neutro
5533,6/15/2022,Tu que está copeandole al Elon Musk la rata hebrea ,NegroBasado,Negativo
5536,6/15/2022,Twitter confía en cerrar la oferta de compra de Elon Musk  ,elfinancierocr,Neutro
5561,6/15/2022,"Elon Musk les hablará a los empleados de Twitter el jueves por primera vez desde que ofreció 44.000 millones de dólares por la compañía de redes sociales, dijo la empresa el martes.  
#NoticiasDNN ",dominicannewsn,Neutro
5569,6/15/2022,"#EconomíaHOY Cuántos miles de millones de dólares perdieron Elon Musk, Jeff Bezos y Mark Zuckerberg  

#Millones #Dólares #Pérdidas #ElonMusk #JeffBezos #MarkZuckerberg #PeriódicoHOY #ElHOY #HOYDigital #GuardianesDeLaVerdad",PeriodicoHoy,Neutro
5611,6/15/2022,"Por primera vez, Elon Musk votó republicano. El emprendedor se muestra cada vez más distanciado de la izquierda progresista. Ha denunciado la cultura de la cancelación, la censura y las políticas de confinamiento. 
",AssaCaribbean,Positivo
5665,6/15/2022,Elon Musk apeló la negativa de un juez a poner fin a su acuerdo de 2018 con la Comisión de Bolsa y Valores de Estados Unidos. ,Forbes_Mexico,Positivo
5700,6/15/2022,"#15Jun || El gerente de #Tesla en Singapur, Christopher Bousigues, fue despedido. Elon Musk inició despidos masivos. ",adultojovenfm,Neutro
5743,6/15/2022,". mencionó que la nueva fábrica  será para mantener y aumentar la producción.  smiling_face_with_sunglasses 

",heraldobinario,Neutro
5747,6/15/2022,"Elon Musk votara republicano por primera vez, y lo hara por  

#RedWave2022 ",alfredorivas184,Neutro
5748,6/15/2022,"El multimillonario Elon Musk anunció que instalará en Panamá el sistema de internet satelital de Starlink y su empresa aeroespacial SpaceX, una nueva ola de importantes inversiones para la economía panameña.
#Panama ",HugoSantaromita,Positivo
5751,6/15/2022,"Para los q están celebrando el enviar cohetes dsd Ceiba Y NO HAY UN SISTEMA DE TRANSPORTE EFICAZ Y NI EFICIENTE ENTRE PR, CULEBRA Y VÍEQUES, NI UN HOSPITAL, Elon Musk looks up, residents down below say his rockets make life unbearable  a través de ",TARAVERDE20,Negativo
5757,6/15/2022,Elon Musk les hablará a los empleados de Twitter esta semana (Por el Ojo de la Cerradura - Periódico Digital Dominicano) -  ,porojocerradura,Neutro
5758,6/15/2022," money_with_wings ¿Cuántos miles de millones de dólares perdieron Elon Musk, Jeff Bezos y Mark Zuckerberg en lo que va del 2022?

 backhand_index_pointing_right Jeff Bezos: 65.300 millones de dólares.

 backhand_index_pointing_right Mark Zuckerberg: 64.400 millones de dólares.

 backhand_index_pointing_right Elon Musk, 73.2 mil millones de dólares.

Business Insider ",juanpadeleo,Neutro
5760,6/15/2022,"En las últimas horas se filtró un mail interno de #Twitter, en el cual se confirma un encuentro virtual entre Elon Musk y los trabajadores de la empresa, los cuales podrán hacerle preguntas. 

 ",forbesecuador,Neutro
5764,6/15/2022," poca broma me da hasta penita el absoluto pánico q le tiene este hombre a la muerte, esq q haces diciéndole a elon musk q no se centre en tener hijos y que consiga la cura de la inmortalidad  skull  skull  ",ndenominativo,Neutro
5766,6/15/2022,"Fortunas Bajo Presión: Elon Musk, Jeff Bezos Y Mark Zuckerberg Pierden Miles De Millones De Dólares Notidigital RD  ",notidigitalrd1,Negativo
5474,6/15/2022,"Esto lo usó Elon Musk en una entrevista, señalando que es parte de su forma de ser...y nos lo aconseja. ",Milos_nfc,Neutro
5502,6/15/2022, Este debe estar en alguno de los satélites que Elon Musk mandó al espacio,cbaldinook,Negativo
5507,6/15/2022,"#Economia | Elon Musk aseguró tener un «supermal presentimiento» sobre la economía, y por eso decidió recortar el 10% de sus empleados en todo el mundo, incluso el gerente de Tesla en Singapur, Christopher Bousigues, fue despedido. #15Jun - Vía El Nacional ",LlaneroDigitalV,Neutro
5538,6/15/2022,Hablar de Elon musk me dan acidez,laburriquita69,Negativo
5558,6/15/2022,Elon Musk escribió en Twitter que se inclinaba por votar por el gobernador Ron DeSantis en la carrera presidencial republicana de 2024. ,El_Sentinel,Neutro
5568,6/15/2022,  Leí la nota.  Estamos condenados.  Por eso es que Elon Musk quiere colonizar Marte...,csanromano,Neutro
5609,6/15/2022,Elon Musk mencionando a su chef favorito. ,tgaude,Positivo
5647,6/15/2022,Se complica la compra de Twitter por Elon Musk ,TuquequeNews,Neutro
5659,6/15/2022,Elon Musk considera a México como una de las opciones para abrir una fábrica de Tesla ,RAFAELLO64,Neutro
5699,6/15/2022,"Fortunas bajo presión: cuántos miles de millones de dólares perdieron Elon Musk, Jeff Bezos y Mark Zuckerberg en lo que va del año ",infobaeamerica,Negativo
5731,6/15/2022,Elon Musk se :inclina: a votar por Ron DeSantis en unas elecciones presidenciales  ,ContraPoder30,Neutro
5753,6/15/2022,"Fortunas bajo presión: cuántos miles de millones de dólares perdieron Elon Musk, Jeff Bezos y Mark Zuckerberg en lo que va del año - Infobae ",GerardoAngulo6,Neutro
5783,6/15/2022,"Según fuentes de la compañía, Elon Musk podría usar los datos de usuarios de Twitter que le ha cedido la compañía para renegociar su oferta de adquisición. ",BIEspana,Neutro
5784,6/15/2022,seguro q la pueden hace pero no lo hacen pa vender mas aires acondicionaos elon musk ,fullerofullerx,Neutro
5787,6/15/2022,"Todavía no seguís a  ? Pero si es lo mejor que le ha pasado a Twitter desde que Elon Musk se rajó en comprar las acciones!!! Además están a punto de estrenar nueva obra. Si me queréis, suscribirsen!!!! ",vonlichtenkraut,Negativo
5788,6/15/2022,"#RegeneraciónMx Este es el siguiente plan del polémico empresario y México está en la mira  eyes  eyes  eyes 

",RegeneracionMx,Negativo
5789,6/15/2022,Elon Musk cree que las criptomonedas están muertas y los bienes raíces serán los siguientes ,LaCriptomoneda1,Neutro
5790,6/15/2022,"El #Starship (el cohete que parece nave de Flash Gordon) de  podría realizar su primer vuelo el mes que entra.
El propio Elon Musk lo anunció en su cuenta de Twitter. ",areygadas,Neutro
5455,6/16/2022,"  Elon Musk detesta a los Comunistas .

Buscan el control total y cambiar toda historia",sin_socialismo,Negativo
5464,6/16/2022,":Tenemos la intención de cerrar la transacción”, indicó el presidente del consejo de administración de Twitter, Bret Taylor, al referirse a la venta de #Twitter a #ElonMusk
",Revista_EyN,Neutro
5494,6/15/2022,. reacciona al apoyo de Elon Musk: :Agradezco el apoyo de los afroamericanos: ,SoTruth1,Positivo
5532,6/15/2022,  Esas 25 pesetas de tu abuela valen más que 30 millones de Elon Musk,bartlebyt,Negativo
5535,6/15/2022,"no entra, elon musk maldito dejame
 editar tweets",amalia1148,Neutro
5550,6/15/2022,//ELON MUSK SE EU TE PEGAR NO SOCO,mlkazulzinho,Neutro
5604,6/15/2022," En un capítulo le :lame el culo: a Elon Musk justo cuando acaba de matar un aguila con su cohete.

Nuestra Lisa ha muerto :c",Fobos002,Negativo
5613,6/15/2022,"Cuántos millones perdieron Elon Musk, Jeff Bezos y Mark Zuckerberg  ",PFConsulting2,Neutro
5676,6/15/2022,"Hace días les contamos detalles de Alexandr Wang, proclamado como el nuevo Elon Musk. Pero, ¿Qué sabemos de la empresa que fundó?  eyes 
",fayerwayer,Positivo
5678,6/15/2022,"El CEO de Amazon, Jeff Bezos; Elon Musk, de Tesla y Mark Zuckerberg, de Meta, han visto caer su patrimonio neto en un total combinado de 200 mil mdd este año. #RegístrateGratis ",reformanegocios,Neutro
5686,6/15/2022,"#ElonMusk, la primera persona en alcanzar el estatus de trillonario para 2024. money-mouth_face  face_screaming_in_fear 

Todos los detalles  backhand_index_pointing_right_medium_skin_tone   ",QueTalmagazine,Positivo
5697,6/15/2022, hollow_red_circle #LaRealNoticiaOnline   diamond_with_a_dot México entre las Opciones de #ElonMusk para la Abrir la Nueva  high_voltage Fabrica de #Tesla ,LaRealnoticia,Neutro
5719,6/15/2022,#EsTendencia Elon Musk y Dorsey dicen que C es el mejor lenguaje de programación  #Programación  #Desarrollo #Tendencias #lenguajeC #Reclunautas,Reclunautas1,Neutro
5730,6/15/2022,"Elon Musk es el Edison del siglo XXI.

Y no, no lo digo como un halago. ",SarcasmOsito,Positivo
5732,6/15/2022,"Twitter sigue contando con su adquisición por parte de Musk: (AFP) El presidente del consejo de administración de Twitter, Bret Taylor, confirmó este miércoles que la red social espera que la oferta de compra de Elon…  #pisandolaraya #Actualidad #Mundo",Alcemos_La_Voz,Neutro
5736,6/15/2022,Muchas veces las represas bloquean las rutas de reproducción y alimentación de los peces. Ahora un sistema de tubos lanza a los peces de un lado al otro del río al estilo de un tubo de vacío o del famoso :Hyperloop: de Elon Musk.  ,radio_nicaragua,Neutro
5737,6/15/2022,Elon Musk crying on the floor of Nuevo León's Pesquería's Spaceport's Space Tragedies Wax Museum. ,AttackMonterrey,Negativo
5750,6/15/2022, mobile_phone  #Tecnología Elon Musk valora a México para la siguiente sede de Tesla: El CEO de Tesla valora la posibilidad de instalar en México la nueva fábrica de la compañía de autos eléctricos… ,OcaReputacion,Positivo
5752,6/15/2022,Elon Musk les hablará a los empleados de Twitter esta semana  #Pisandolaraya #Dajabon #Noticias,pisandolaraya,Neutro
5777,6/15/2022,"La Base Estelar de la playa de Boca Chica, en Texas, ha levantado polémica estos últimos meses, en especial por el impacto ambiental que supone, así que la compañía de Elon Musk planea un traslado de la nave estelar al Centro Espacial Kennedy de la NASA. ",NatGeoEspana,Positivo
5782,6/15/2022,Cuando el filtro que te pone triste cuando sonríes ve a Elon Musk ,GJuancaweed,Positivo
5453,6/16/2022," Pues eso dice acá, pero hasta que Elon Musk no lo confirme será una presunta suripanta.",2jairo4,Neutro
5520,6/15/2022,Mi alma en sacrificio para que Elon Musk ya ponga el :editar tweet:.,Gema_Boo_,Neutro
