Id,Fecha,Tweet,Usuario,Clasificación
3,6/1/2022,Una ultima prueba de cargar tweets,alejandro,Neutro
4,5/31/2022,esta es una prueba de tweet enviado,alejandro,Neutro
11,3/3/2022,hola profe,miusuario,Neutro
47,6/13/2022,"La FAA ha autorizado a SpaceX a utilizar su puerto espacial de pruebas en Texas. Tras una exhaustiva evaluación ambiental, la autoridad que gobierna el espacio aéreo en los EEUU le dio luz verde al nuevo cohete de Elon Musk y cía.",Guido de Caso :rocket:,Neutro
62,6/13/2022,"Es de las conspiranoicas,de las que creen que la nieve es plástico,el agua no hidrata y que las vacunas son un chip de Elon Musk.Asi que teniendo en cuenta esto yo creo que su opinión tiene validez nula....",:sparkles::cherryblossom:  :cherryblossom::sparkles::seedling:,Positivo
64,6/13/2022,si elon musk saca un chip neuronal ME LO VOY A PONER ya me cansé,Arcana :cloudwithlightning:,Positivo
69,6/13/2022,elon Musk t odio m debes 5 de hachís,RamónSifón,Negativo
75,6/13/2022,De Stephen Hawking a Elon Musk: por qué la IA cada vez genera mayor preocupaciónentre los expertos  from FeedLab,Miguel Angel,Neutro
78,6/13/2022,lo siento twitter era un chiste aunque nose si a elon musk le moleste la M palabra,Wubban,Negativo
83,6/13/2022,"Tras lo sucedido con la IA de Google, nuevamente hacen ruido las advertencias de Elon Musk sobre la inteligencia artificial. Por qué los expertos están cada vez más preocupados",Hipertextual,Positivo
87,6/13/2022,":mushroom: El CEO de   volvió a mostrarse a favor de los psicodélicos en Twitter. Esta vez, destacó el trabajo de , una empresa de biotecnología que se centra en el progreso de estos por vía terapéutica y mediante la ingeniería :labcoat:.   :backhandindexpointingleft:",El Planteo,Neutro
102,6/13/2022,Biden respondió a Elon Musk tras su mal presentimiento sobre la economía de EEUU,El Político,Neutro
105,6/13/2022,"La empresa SpaceX, propiedad del multimillonario Elon Musk, lanzará su sistema de internet satelital Starlink en Panamá.  ExitosaNoticias",La Exitosa 95.3 FM,Positivo
111,6/13/2022,Los 5 estadounidenses más ricos de todos los tiempos: Elon Musk ocupa el tercer lugar,El Diario Nueva York,Positivo
114,6/13/2022,No necesita bodega cuando tiene Ancianazi lavador y traquetos voltea tierra se cree elon Musk para desprestigiarlo.,Aemon Targaryan :multiply:,Neutro
147,6/15/2022,Dalas creyéndose que está hablando con Elon Musk:,scar :keycap_1::keycap_4::trophy:,Positivo
151,6/15/2022,Lo más triste es que este mindundi se creerá de verdad que Elon Musk va a utilizar su tiempo en leer a un subnormal diagnosticado hablar sobre la inmortalidad,s,Neutro
177,6/15/2022,"Elon Musk les hablará a los empleados de Twitter el jueves por primera vez desde que ofreció 44.000 millones de dólares por la compañía de redes sociales, dijo la empresa el martes.   #NoticiasDNN",Dominican News Network,Neutro
189,6/15/2022,"por regla general cualquier persona que comparta imágenes inspiracionales con fotos de elon musk, steve jobs, etc muy probablemente sea INSOPORTABLE",matugon con calma,Positivo
190,6/15/2022,"Talvez todo el tiempo que hablo de un hombre poderoso, se refería a Elon Musk    :woman_shrugging:",Jorge Ovalle,Positivo
208,6/15/2022,"Ostias bro yo también lo había entendido así, y digo joder, si eso no llega ni el mismísimo elon musk",Jero :melting_face:,Positivo
209,6/15/2022,Ahora que Elon Musk compro twitter tuitea mas que antes,Steven,Positivo
377,6/15/2022,solo en gorila esquizo. una fortuna que perdieron en 2022 los multimillonarios elon musk y jeff bezos: los pumas y un ex all blacks.,gorilaesquizo,Neutro
379,6/15/2022,desantis responde al apoyo de elon musk ante posible candidatura a la presidencia - #evnews #rondesantis #elonmusk,Venezolanonews,Neutro
390,6/15/2022,elon musk escribio en twitter que se inclinaba por votar por el gobernador ron desantis en la carrera presidencial republicana de 2024.,El_Sentinel,Neutro
395,6/15/2022,"es un gran idiota, tesla perdio el 45% de su capitalizacion de mercado desde el pico. elon musk perdio casi la mitad de su riqueza en el colapso de las acciones, incluida su inversion en bitcoins, que se desplomo un 66 %.",Jule_Hune,Negativo
408,6/15/2022,"con elon musk a la cabeza, la lista de las personas mas ricas del mundo vivio un ano volatil, coronado por un colapso mundial en el precio de las acciones. ?quienes acompanan al dueno de tesla en la lista? descubrelo en nuestra #edicionimpresa. !ya en circulacion!",forbesecuador,Neutro
415,6/15/2022,"wey, tumbaron la cuenta de :( cuantos mas, elon musk?",SandraMolko,Negativo
417,6/15/2022,"?los dices por elon musk, elxokas, sergio ramos o por ...? a ver si va a ser condicion sine qua non para ser rico.",Caos_Desatado,Neutro
418,6/15/2022,simultaneamente con la compra de todas las escuelas x parte de elon musk,RVerbalKint,Neutro
1,6/1/2022,Prueba de tweet en clase,alejandro,Neutro
9,3/3/2022,este es un nuevo texto de prueba,miusuario,Neutro
14,3/3/2022,matias prueba este es un nuevo texto de prueba,miusuario,Neutro
46,6/13/2022,"Por qué Elon Musk está obsesionado con los bots de Twitter, ¿tan importantes son?",ComputerHoy.com,Neutro
51,6/13/2022,"Yo lo tengo claro, Elon Musk o Jeff Bezos, les dejo interactuar con mi cuenta todo lo que quieran, acepto Bizum, Transferencia, Verse y de todo.",Javier Ruiz,Neutro
52,6/13/2022,Elon Musk es la epitome de lo que pueda salir mal va a salir mal.,Emiliano Rosas,Negativo
55,6/13/2022,Elon musk a comprado ya Twitter o aún no se puede decir kIll 4ll man,Mayte,Neutro
56,6/13/2022,"Esque eso és madurar, aver si maduramos nosotros como ha hecho Willy, nos sacamos 4 carreras y nos convertimos en empresarios exitosos como él, que seguro que su fortuna supera con creces la de Jeff Bezos y Elon Musk juntos",El Alto,Neutro
121,6/14/2022,elon musk twitteó un meme... y me reí. ¿es esta mi transición a fifa?,k4tluvr,Positivo
160,6/15/2022,habeis oido que elon musk ha comprado tuiter,Nathan,Neutro
163,6/15/2022,Internacionales Elon Musk tendrá su primer encuentro con los trabajadores de Twitter:  .,Actualidad Laboral,Neutro
169,6/15/2022,DeSantis responde al apoyo de Elon Musk ante posible candidatura a la presidencia    #EVNews #RonDeSantis #ElonMusk,El Venezolano,Neutro
176,6/15/2022,Hacele la cuenta Elon Musk o Michael Saylor y les escribes a ver q te dicen  Stupid minimo:rolling_on_the_floor_laughing:,Bastian,Negativo
191,6/15/2022,"Conoces a Bill Gates, a Carlos Slim, a Elon Musk   Pregúnteles si ya no necesitan más plata :person_shrugging::person_facepalming::woozy_face:",J.Gamez,Negativo
394,6/15/2022,culpa do elon musk.,otaldotonin,Negativo
405,6/15/2022,"elon musk va a dejarse 40 millones en esta mierda, enhorabuena retrasado:first_place:",albertofdezz__,Negativo
426,6/15/2022,"twitter y moi, una bonita historia de una decada ya. gracias por ser mi psicologo sustituto imaginario. (es mi relacion mas duradera) (odio a elon musk)",mirandaterrazas,Negativo
427,6/15/2022,como el tweet eliminado de elon musk,ExSwampert,Neutro
429,6/15/2022,elon #musk ya tiene candidato a presidente. y es republicano. #cryptocurrencies #bitcoin #ethereum #nft #nfts #nftcommunity #othereconomy #otraeconomia #metaverse #gold,MaximilianLex4,Neutro
431,6/15/2022,el empresario solia usar twitter para especular y eso movia el precio sus acciones.,BusInsiderMX,Neutro
433,6/15/2022,"si, elon musk escucho mis suplicas y me dio pene",IBOTS0FT,Positivo
438,6/15/2022,empiece comprando una accion del twitter (nasdaq: twtr) que han estado subiendo desde el 2006 porque elon musk las quiere comprar todas para que pueda donar un poco de leche y cereal a todos sus empleados. si no sabe como hacer eso con su cel entonces me puede seguir.,guillu,Positivo
439,6/15/2022,pero muy tirando de la gente de fing pa la izquierda el resto son todos adoradores de elon musk,ElDiegoDejo,Neutro
440,6/15/2022,elon musk parece que tiene un bajo a culo encima,brujaqua,Negativo
442,6/15/2022,y el agua apa?,huashorodriguez,Neutro
445,6/15/2022,"alana, o elon musk esta nos discriminando!!!!!",rafvsk,Neutro
446,6/15/2022,spacex se establecio en boca chica con la idea original de lanzar sus cohetes parcialmente reutilizables falcon 9 para poner satelites en orbita.,laprensa,Neutro
451,6/15/2022,si las cosas no fallan ... no estas innovando lo suficiente. elon musk,_SandroPaz,Neutro
452,6/15/2022,"aqui esta plasmada la respuesta de elon musk sobre, a quien apoyaria para la presidencia:arrow_heading_down: desantis",Maria1Guadalupe,Neutro
6,3/3/2022,este es un nuevo texto de prueba,miusuario,Neutro
7,3/3/2022,este es un nuevo texto de prueba,miusuario,Neutro
8,3/3/2022,este es un nuevo texto de prueba,miusuario,Neutro
10,6/1/2022,"Que algoritmo de mierda está teniendo Twitter. Si no le pongo fav a un tw me sigue apareciendo en el tl. La concha de su madre, no le quiero poner fav a esa mierda volvé Elon Musk",ivan'ts,Neutro
23,3/3/2022,este es un nuevo texto de pruebaa,miusuario,Neutro
57,6/13/2022,hoy ud apoya a un social demócrata confeso en sus palabras y su política me resulta extraño que se reconozca flia Cristina y la ataque al mismo tiempo para mi ud es un mercenario hoy es el pitbull de AF ud tiene de peronista lo yo tengo de Elon Musk. ud es un simple burócrata.,Angel RobertoVelasco,Neutro
79,6/13/2022,:comet:  El Hyperloop de Elon Musk es posible. Qué tanto lo queremos,Tecnovedosos,Positivo
80,6/13/2022,"Vientos difíciles soplarán en Tesla, según Elon Musk. Por qué Esto dijo el CEO a sus trabajadores:",Bloomberg Línea,Neutro
93,6/13/2022,Para ti tiene más valor Elon Musk que un asesino en serie. Habría que preguntarle a la mamá del asesino en serie quién tiene más valor. La dignidad moral es subjetiva y depende del marco moral en el que se desarrolle.,David Ghisays,Positivo
99,6/13/2022,Esto no le va gustar a Elon Musk,BerthaW:Nicaragua::CeutaMelilla::U.S.OutlyingIslands:,Neutro
101,6/13/2022,Yo: Odio a Elon Musk :poutingface:  Yo tambien: Amo Paypal :smilingfacewithhearteyes:,Gabivero,Negativo
103,6/13/2022,"Gracias a Dios no.  Doy trabajo también. Fumadote como Obama, Elon Musk, Richard Branson. No como cualquier mamerto vago.",Gato Perfumado,Positivo
109,6/13/2022,"Como caminaria el :globeshowingAsiaAustralia: si hubiera 10,000 Elon Musk  :rocket::flyingsaucer::sun::flyingsaucer::rocket:",BizTechia,Positivo
113,6/13/2022,Ahhh pero que ya vas de Elon Musk Cuando te has comprado Twitter,LaSuki,Neutro
167,6/15/2022,S LO EN GORILA ESQUIZO. Una fortuna que perdieron en 2022 los multimillonarios Elon Musk y Jeff Bezos: Los Pumas y un ex All Blacks.,Gorila Esquizo,Negativo
172,6/15/2022,Elon Musk 2.0    Bill Gates quiere bloquear el sol y enfriar el planeta: cómo piensa hacerlo,Ministro Limón,Negativo
174,6/15/2022,"""Elon Musk: La civilización va camino de desmoronarse"" #Japalpilpa",usuario,Neutro
175,6/15/2022,"NO0O00OO0OO0O0 QU  HACES TENIENDO HIJOS, ELON MUSK     DEBER AS ESTAR USANDO TU DINERO PARA HACERME INMORTAL  1",(       ),Negativo
185,6/15/2022,Qué es Starlink: cuánto cuesta en Chile y cómo funciona el Internet de Elon Musk   BioBioChile,Zicutake,Neutro
192,6/15/2022,"Te estás desviando del argumento. Hablo de meritocracia porque tú hace un momento sostenías que Elon Musk se merecía su fortuna y podía hacer lo que quisiera con ella porque ""para eso trabaja"". Como si su riqueza no proviniera de otras problemáticas que ya comentó .",Ana María Acosta,Negativo
205,6/15/2022,elon musk va a pagar por twits vírales :face_screaming_in_fear::face_screaming_in_fear::face_screaming_in_fear:,:bubble_tea:Rafa,Negativo
380,6/15/2022,"las notas vespertinas ya estan aqui. leelas completas en :globe_with_meridians:. 1. controversial decision de la reserva federal, subira la tasa de interes 2. elon musk apoya a desantis #noticiasvespertinas #rondesantis #elonmusk #noticiasenespanol",prensafl,Neutro
383,6/15/2022,twitter sigue considerando a elon musk como su comprador,nahum_sv,Neutro
401,6/15/2022,"por regla general cualquier persona que comparta imagenes inspiracionales con fotos de elon musk, steve jobs, etc muy probablemente sea insoportable",matugon4,Negativo
424,6/15/2022,"viendo lo facil que es convencerte de chorradas sin fundamento: ?quieres invertir en criptomonedas? si metes todo tu dinero en criptos, escapas del control del gobierno. lo dice elon musk.",MaeseSonoro,Negativo
432,6/15/2022,"el multimillonario elon musk dijo que votara por los republicamos ""por primera vez"" y que ron desantis, gobernador de florida, tiene ""mas posibilidades de ganar""",DLasAmericas,Neutro
457,6/15/2022,"elon musk siempre peca de optimismo. desde hace anos, jajajaja",alex_riveiro,Negativo
5,5/31/2022,esta es una prueba de tweet enviado de vuelta,alejandro,Neutro
42,6/13/2022,...a ver si la compra Elon Musk...,Chicken in self destruction mode,Neutro
44,6/13/2022,"BIEN Q LA TECNOÑOGÍA AVANCE PARA EL BIEN EN PANAMÁ, PERO QUISIERA Q SE HICIERAN EXPERIMENTOS CON CHIP CEREBRAL CON LAS RATAS DEL GOBIERNO Y NO CON PANAMEÑO DE A PIES.  Neuralink de Elon Musk alista chip cerebral para primeros ensayos clínicos en humanos",MUNDO SIN CENSURAS,Negativo
49,6/13/2022,: 7f90531d826547b582707cd8df26f90c,Test Account1,Neutro
50,6/13/2022,"Por desgracia, se llama genio solo al que se forra. Biza es un revolucionario, Elon Musk es un Da Vinci, Bezos es un visionario, etc. El resto de personas que hacen cosas increíbles y no tienen un duro, pues son unos mediocres.",Mujik Gorki,Positivo
54,6/13/2022,Menos mal que Elon Musk va a acabar con todos ellos,Leonor de Bourbon,Neutro
68,6/13/2022,Vamos a discutir que Elon Musk es desclasadoa,Bot Politica ARGENTINA,Negativo
72,6/13/2022,"suponiendo q estamos hablando de deseos ""reales"", tener la misma cantidad de dinero q elon musk",:sleepingface:,Positivo
76,6/13/2022,"Pues aquí seguimos, Elon Musk.",Ral Calbria,Neutro
81,6/13/2022,Que alguien le diga a Elon Musk que le cierre la cuenta de Twitter al  por favor.,Carnaval365,Positivo
86,6/13/2022,"Soy César Boada de nuevo y quiero hacerte otra pregunta de opinión: Si Elon Musk propietario de Twitter, te invitara al espacio tu lo aceptarias. Ademas de la lucha libre como se te vio con el Santo, que artista marcial admiras. Espero tus respuestas. Saludos.",Cesar Boada,Neutro
88,6/13/2022,"Por qué Elon Musk está obsesionado con los bots de Twitter, tan importantes son",ComputerHoy.com,Neutro
89,6/13/2022,"O comparemos a Elon Musk junto con un hombre musulmán que golpea a su esposa. Para nosotros, personas de moral occidental, el musulmán no tiene dignidad moral, y por ende ""valdría"" menos. Para sus líderes religiosos es un hombre respetable.",David Ghisays,Neutro
98,6/13/2022,Si a mi también me va decir que soy el único heredero de la FORTUNA de Elon Musk.,Marcelo MacCallum :thumbsup::UnitedStates::UnitedStates::UnitedStates::Norway::Finland:,Neutro
106,6/13/2022,No es oro todo lo que reluce y twitea elon musk,jose luis lopera,Negativo
150,6/15/2022,#Internacionales Elon Musk tendrá su primer encuentro con los trabajadores de Twitter:  .,Actualidad Laboral,Neutro
156,6/15/2022,DeSantis responde al apoyo de Elon Musk ante posible candidatura a la presidencia   EVNews RonDeSantis ElonMusk,El Venezolano,Neutro
158,6/15/2022,ELON MUSK SE EU TE PEGAR NO SOCO,yato  namoradinho do Nemi,Neutro
159,6/15/2022,ELON MUSK PRESIDENTA 2028,Juan P Matute R,Neutro
162,6/15/2022,""":bomb: Cuando algo es lo suficientemente importante, lo haces incluso cuando las posibilidades no están en tu favor.  Elon Musk (1971actualidad)""",Paperboys,Positivo
170,6/15/2022,"Las notas vespertinas ya están aquí. Léelas completas en  :globe_with_meridians:.  1. Controversial decisión de la Reserva Federal, subirá la tasa de interés 2. Elon Musk apoya a DeSantis  #noticiasvespertinas #RonDeSantis #ElonMusk #noticiasenespañol",La Prensa Orlando,Neutro
171,6/15/2022,El dueño de tu marca preferida no comenta en los tweets de sus fiebrus :rolling_on_the_floor_laughing: Elon Musk la ley,CJ Sepu,Neutro
184,6/15/2022,Elon Musk desea terminar con bots y cuentas infladas.  Pueden empezar analizando el #ChongTítereDeMorena que hasta con acento lo pusieron. Jajaja.,Aleks,Neutro
196,6/15/2022,"Con Elon Musk a la cabeza, la lista de las personas más ricas del mundo vivió un año volátil, coronado por un colapso mundial en el precio de las acciones.   Quiénes acompañan al dueño de Tesla en la lista  Descúbrelo en nuestra #EdiciónImpresa.  Ya en circulación",Forbes Ecuador,Neutro
197,6/15/2022,"""Simultáneamente se nos dice que las diferencias de género no existen y que los géneros son tan diferentes que la cirugía irreversible es la única opción. Quizás alguien más sabio que yo pueda explicar esta dicotomía."" Elon Musk",Jose Pedro Urraburu,Neutro
200,6/15/2022,eee piro soy amigo de elon musk,tucu,Positivo
203,6/15/2022,Elon Musk endorsed DeSantis.  :face_with_tears_of_joy::rolling_on_the_floor_laughing::face_with_tears_of_joy::rolling_on_the_floor_laughing::face_with_tears_of_joy::rolling_on_the_floor_laughing:,TACCOVP17,Negativo
244,6/15/2022,:bomb: elon musk abre el primer tunel subterraneo para aliviar el trafico en los angeles...,BIGThinkBIG_,Positivo
370,6/15/2022,"ya la gente no sabe quien es elon musk, y si acaso te dicen: ""el de los coches electricos esos"". como para que sepan que es sudafricano :joy::joy::joy::joy:",Javifiorentino4,Negativo
2,6/1/2022,Esta es otra prueba de cargar un tweet,alejandro,Neutro
21,3/3/2022,este es un nuevo texto de prueba,miusuario,Neutro
22,6/8/2022,Tienes que estar muy jodido intelectual mente y ser un estúpido para consumir e invertir en contenido progresista !  https://t.co/BHppKM1gJA,El Macho Biónico,Negativo
41,6/13/2022,No es oro todo lo que reluce y twitea elon musk https://t.co/wRBdr2ZXla,jose luis lopera,Negativo
43,6/13/2022,"Los ricos no tienen tiempo para la vagueria,.pregúntale a Elon Musk",Paúl,Positivo
45,6/13/2022,":mushroom: El CEO de   volvió a mostrarse a favor de los psicodélicos en Twitter. Esta vez, destacó el trabajo de , una empresa de biotecnología que se centra en el progreso de estos por vía terapéutica y mediante la ingeniería :lab_coat:.   :backhand_index_pointing_left:",El Planteo,Positivo
48,6/13/2022,Vamos ver o que acha Elon Musk,Will,Neutro
53,6/13/2022,"Aunque sea el q compré Twitter lo q vimos y sabemos no lo limpia nunca más, aunque diga era un juego nadie nunca jamás le creerá y será odiado forever dónde trabaje generará ruido y perjudicará a todos con sus antecedentes, la gente no es boluda   Elon Musk Salwe compra Twitter",Pablo Gomez,Negativo
63,6/13/2022,"ElHotelDeLosFamosos   Presentamos los bots deSalwe ya ni Elon Musk quiere comprar twitter, Salwe lleno de bots (cuentas falsas) la red Manipulación ja que imagen va a cambiar si vimosTodo   ElHotelDeLosFamosos  Salwe misógino xenófobo homofóbico lacra",José Ostorero,Neutro
65,6/13/2022,Suerte que twitter fue comprado por Elon Musk,leia,Neutro
66,6/13/2022,Jajajaja sus clientes. Tiene una tienda de barrio a la cual hace poco le agrego dos pollos para sumar más gente y se cree Elon Musk.,Maximo,Neutro
71,6/13/2022,Dogecoin ha caído más del 90 desde que Elon Musk lo promocionó en la televisión estadounidense,La Criptomoneda,Negativo
73,6/13/2022,"Mira vos, era amigo de Elon musk y no m había dado cuenta",Valentín,Neutro
77,6/13/2022,hola seguirme sobretodo el elon musk,Martí (simp de neo) :growingheart::tornado:,Neutro
84,6/13/2022,"Hey, Elon Musk no te olvides de nosotros simples mortales Haz tu llamado cuando sea el momento y dinos de alguna manera que eres tú realmente",Irma  Jiménez,Neutro
85,6/13/2022,"una batidora recargable con energía solar , la hizo elon musk",,Positivo
90,6/13/2022,"Evidentemente no entendés demasiado del mundo real. Bill gates es otro genio que ni siquiera terminó la universidad. No tenés idea de lo que hizo o no hizo Elon musk. Leé su historia en vez de pensar simplemente que es un ""millonario con suerte"".",Maximo Zapata,Negativo
91,6/13/2022,Elon Musk vai te contratar,Allan Campos :blueheart::redheart::Spain:,Positivo
92,6/13/2022,te falta la sandia para ser elon musk,LookingForSomething,Positivo
94,6/13/2022,"BIEN Q LA TECNOOGA AVANCE PARA EL BIEN EN PANAM, PERO QUISIERA Q SE HICIERAN EXPERIMENTOS CON CHIP CEREBRAL CON LAS RATAS DEL GOBIERNO Y NO CON PANAMEO DE A PIES.  Neuralink de Elon Musk alista chip cerebral para primeros ensayos clínicos en humanos",MUNDO SIN CENSURAS,Negativo
104,6/13/2022,"Nico, sos el único argentino que TENEMOS que ver junto a Elon Musk",Agustín Esposito,Positivo
108,6/13/2022,"Ningún exempleado de elon musk se le ocurriría escribir un libro sobre lo estricto que es como jefe, porque no sorprendería a nadie, sería como ""ya, y que esperas""",that nymph,Positivo
112,6/13/2022,Ni Elon Musk tiene esa tecnología,:whale:Angel Salinas:whale:(22 días:partypopper:),Neutro
373,6/15/2022,"que pesados os poneis con el game pass de los cojones y el plus premium, madre mia, si me dieran un euro cada vez que veo mediros la pollas con el tema seria competencia de elon musk.",RuymanJ,Neutro
387,6/15/2022,#internacionales elon musk tendra su primer encuentro con los trabajadores de twitter: .,ActualidadLabor,Neutro
388,6/15/2022,lo mas triste es que este mindundi se creera de verdad que elon musk va a utilizar su tiempo en leer a un subnormal diagnosticado hablar sobre la inmortalidad,putamxracas,Negativo
389,6/15/2022,"""elon musk: la civilizacion va camino de desmoronarse"" #japalpilpa",vilpetrus,Negativo
391,6/15/2022,"no0o00oo0oo0o0 que haces teniendo hijos, elon musk!?!? deberias estar usando tu dinero para hacerme inmortal!!1!",DarthWeeb66,Positivo
403,6/15/2022,"conoces a bill gates, a carlos slim, a elon musk ? pregunteles si ya no necesitan mas plata :person_shrugging::person_facepalming::woozy_face:",jgamez927,Negativo
411,6/15/2022,"#tesla elon musk esta considerando a estados unidos, canada y mexico como los paises donde podria construir una nueva fabrica de la compania de vehiculos electricos y autonomos tesla. #edntv #elonmusk #estadosunidos #canada #mexico #vehiculoselectricos",EDNTVHN,Positivo
508,6/15/2022,"desde que elon musk compro twitter, se puede decir cualquier cosas!",crigoit,Positivo
550,6/15/2022,elon musk presenta recurso para evitar que tesla investigue sus publicaciones en twitter :point_right:,AristeguiOnline,Neutro
609,6/15/2022,que es esto de superseguir? elon musk que hicistes?,tavoomartin,Negativo
639,6/15/2022,"no entra, elon musk maldito dejame editar tweets",amalia1148,Negativo
2844,6/15/2022,dios mio twitter me recomienda esto en serio no puedo esperar a que elon musk tome el control,leia39632525,Positivo
3291,6/15/2022,#EconomiayNegocios Elon Musk podría instalar una fábrica de Tesla en México https://t.co/tseWRpXV1E,ImagendeVer,Neutro
3301,6/15/2022,"Cuántos miles de millones de dólares perdieron Elon Musk, Jeff Bezos y Mark Zuckerberg  https://t.co/C1DL1hGazH",MegaDiarioRD,Neutro
3302,6/15/2022,"Elon Musk es un white supremacist porque votó a Mayra Flores, una mujer negra mexicana. Ya el Progresismo está en modo desesperación absoluta. https://t.co/vzLEWT8ylh",AgusRockstain,Positivo
2874,6/15/2022,presiosa mi embajadora,farabundou,Neutro
2879,6/15/2022,esooooooo dele con todo,carlosrchurulo,Positivo
2888,6/15/2022,spacex tiene via libre para realizar lanzamientos orbitales a marte,reportelatinoa,Neutro
2893,6/15/2022,spacex se acerca aun mas a marte tras recibir luz verde de la faa,uniondemorelos,Neutro
2898,6/15/2022,ya llevo apenas mas carga que un unico saturn v para poner en perspectiva lo bestial que era aquel bicho,guidodecaso,Neutro
3381,6/15/2022,El sueño húmedo de Elon Musk es que Amber Heard lo atropelle con un Tesla.,capitalino_azul,Neutro
3394,6/15/2022,"Fortunas bajo presión: Elon Musk, Jeff Bezos y Mark Zuckerberg pierden miles de millones de dólares https://t.co/TFysRLS29J https://t.co/cFdYSIoVY3",keloke_RD,Negativo
2921,6/15/2022,cuanto cobraria un bien cuidao por aparcar un cohete de spacex,ricardochial,Neutro
2922,6/15/2022,mision transporter 5 fotos oficiales de spacex,astraxolotlgirl,Neutro
3412,6/15/2022,Elon Musk mueve mercados,stivenvargas111,Positivo
3428,6/15/2022,"Se puede acusar a Elon Musk de muchas cosas, pero como vivió en público la crisis de la mediana edad más vergonzosa de la historia de la humanidad, no se compara con nada  skull  skull ",AndreaaCornejo,Negativo
2933,6/15/2022,tengo entendido que spacex ya cuenta con mas de 200 satelite en orbita,juan26377286,Positivo
3434,6/15/2022,"  No se sabe con certeza, se asume que es de Elon Musk. Tampoco se sabe si la hicieron de la manera tradicional (que no me extrañaria considerando q le ponían el gorro a Johnny) o si fue por fecundación in vitro.",selenegray_,Neutro
3439,6/15/2022,"SpaceX tendrá un prototipo funcional de su cohete Starship ""listo para volar:en julio, de acuerdo con Elon Musk, quien publicó en un tuit los planes de la compañía para llegar finalmente con su vehículo espacial a la órbita de la Tierra por primera vez.

https://t.co/H6EdeyJV4Y",proZesa_com,Positivo
3442,6/15/2022, Hi Elon Musk permitame el honor de servirle tengo una solución rápida y sencilla para hacer completamente los vehículos sin muchas modificaciones. Y generar mas Ganancias a la Empresa Tesla..por favor contacteme al correo principegerardo123.com,Gerardo61353411,Neutro
2961,6/14/2022,starlink de elon musk esta siendo muy efectiva en ucrania china atenta,carmuzo,Positivo
2964,6/14/2022,zelenski a elon estamos muy agradecidos por el apoyo de starlink,dusanvelez,Positivo
2974,6/14/2022,la proveedora de internet satelital starlink dara servicio en panama,tvporcable,Positivo
3012,6/12/2022,internet satelital de elon musk sigue al starlink logra superar los 3 000 abonados en chile,tvporcable,Neutro
