Id,Fecha,Tweet,Usuario,Clasificación
3792,6/15/2022,"Elon Musk contra el home office: ""Ya no es aceptable""
https://t.co/if02KKpp7u",Ambitocom,Neutro
3796,6/15/2022, se parece a elon musk,juancarloespana,Neutro
3799,6/15/2022,"Cada que alguien les diga k elon musk y los ricos están salvando al planeta muéstrenles este video de un cohete de space x produciendo en promedio entre 200 y 300 toneladas de CO2 en un ratito (un humano produce aprox 340kg en un año como referencia) 

 clown_face  https://t.co/aXAn60apss",julitoaayala,Negativo
3801,6/15/2022,"Tú tíoooo,este hombre solo falta que haga un trato con Elon musk, mis muelas está haciendo demasiados sueños realidad déjame un chin que los estás acaparando https://t.co/fBHwUkcS8j",juanmglxx,Positivo
3803,6/15/2022, Chinga tu madre Elon musk,SaisYepez,Negativo
3806,6/15/2022," CHeca las respuestas a los tweets de Elon musk. Ya el tipo me esta hartando, claro que nadie quiere morir, pero si de verdad estas trabajando en eso, trabajalo en silecion.",JLudociel_16,Negativo
3808,6/15/2022, culpa do elon musk,Phgiviz,Negativo
3810,6/15/2022, é tudo culpa do elon musk ana,agasihideko,Negativo
3811,6/15/2022, collision  El Hyperloop de Elon Musk es posible. ¿Qué tanto lo queremos? https://t.co/FawubJYx1o,GiraInformativa,Neutro
3535,6/15/2022,Elon Musk cuestiona el continuo y evidente sesgo ideológico en Twitter https://t.co/7NYb6B19gx,meier_garcia,Positivo
3541,6/15/2022, crees que elon musk fue a alguna de ingeniería?,aaaa02738831,Neutro
3545,6/15/2022," poca broma me da hasta penita el absoluto pánico q le tiene este hombre a la muerte, esq q haces diciéndole a elon musk q no se centre en tener hijos y que consiga la cura de la inmortalidad  skull  skull  https://t.co/PU9MOYzY47",ndenominativo,Neutro
3578,6/15/2022, Los paramilitares fueron producto de las guerrillas y el narcotráfico pues es una problemática muy arraigada a nuestra tierra. El máximo ejecutor de un Estado es el CEO del mismo. Elon Musk no tiene idea de ciencia. ¿Ves lo irrelevante que es saber?,stonardshelby,Negativo
3612,6/15/2022,"Elon Musk reconoce a la pirolisis de #biomasa como una de las tecnologías más prometedoras para hacer frente al cambio climático 
 https://t.co/VxFF8mmolD #biocompuestos #medioambiente #sustentabilidad #tecnología https://t.co/yo7XiBgqGa",Bioeconomia_web,Positivo
3622,6/15/2022,Jonathan Van Ness tiene la respuesta perfecta para la transfobia de Elon Musk https://t.co/kqVs8ISI5j,visiblechile,Negativo
3636,6/15/2022,"  Ha pasado que se ha obsesionado con Elon Musk t le twittea todos los dias para que le noticee hablándole sobre la inmortalidad, para mi que quiere que le financie o algo JAJAJAJAJAJA",Kawaseal_,Positivo
3655,6/15/2022,"  Eso es una leyenda urbana, Elon Musk es rico de toda la vida, le viene de familia y es mucho peor que el tonto de Sergio Ramos",poketrainer_mad,Negativo
3672,6/15/2022, bomb  Elon Musk abre el primer túnel subterráneo para aliviar el tráfico en Los Ángeles... https://t.co/cQJNvpP9U7,Canal_Z_,Positivo
3700,6/15/2022, pensé que era una foto de elon musk y que lo azul era un cohete,Keyred11,Neutro
3707,6/15/2022,Jonathan Van Ness tiene la respuesta perfecta para la transfobia de Elon Musk https://t.co/04up63YZ6X https://t.co/L9dfFFYiX9,TodoLGTB,Negativo
3713,6/15/2022,Elon Musk inició despidos masivos en Tesla y comenzó por un gerente https://t.co/6cNtUX6lfp,ElNacionalWeb,Negativo
3722,6/15/2022,"  Hasta el propio Elon Musk dijo que la inmortalidad sería contraproducente porque la gente tiende a no cambiar de opinión y por ello nos quedaríamos anclados a ideas desfasadas. 

Por no hablar de la sobreproblación en el largo plazo",Antiiicristo,Positivo
3749,6/15/2022,Qué esperan los empleados de Twitter que Elon Musk les conteste en su próxima reunión https://t.co/8CPXW43U4T,LaOpinionLA,Neutro
3757,6/15/2022," Y ni eso, porque no se dice whitexican solo por tener dinero, no se odia por tener dinero, la gente no odia a elon musk, bill gates, o jeff bezos por tener dinero. Whitexican surgio como una medida de escupir para arriba por tanto tiempo de existir gente que escupe hacia abajo.",max9_k,Neutro
3763,6/15/2022, Ahorita lo compra elon musk  loudly_crying_face ,17santiagoo,Neutro
3778,6/15/2022,"Las ambiciones espaciales del multimillonario Elon Musk están cambiando la economía, demografía e incluso la geografía de un rincón de la frontera entre #EUA y #México, provocando una grieta en la comunidad. https://t.co/q6scBTCrs3",prensagrafica,Neutro
3802,6/15/2022," small_orange_diamond La prueba de fuego para dos sistemas socioeconómicos en competencia es ¿de qué lado se necesita construir un muro para evitar que la gente se escape? ¡Ese es el malo! small_orange_diamond 
Elon Musk 

Buenas noches  first_quarter_moon_face ",gucciflv,Neutro
3500,6/15/2022, La parte de Edison es correcta. Era el Elon Musk de su tiempo.,0Dmon0,Positivo
3514,6/15/2022,$TSLA y Elon Musk huelen a culo. En unos años veremos toda la manipulacion que hay detrás del valor.,frandelatorren,Negativo
3608,6/15/2022,"Abriendo el local tempranito con café,tortafritas y Jamiroquai, Nada que envidiarle a elon musk",orochirotela,Neutro
3621,6/15/2022,"  Acabo de darme cuenta que cuando BTC estuvo en 3k los 19 millones que existen por ahora representan 57mil millones de dólares, Elon Musk pudo comprarlo todo, claro, si se lo vendieran, y cuando llegó a 69k hizo un x23, será que hizo esa jugada? Al menos x15 a mil millones?",cryptomaniaco27,Neutro
3623,6/15/2022,"Fortunas bajo presión: cuántos miles de millones de dólares perdieron Elon Musk, Jeff Bezos y Mark Zuckerberg en l… https://t.co/etvnLmH0om",KIDjuan32,Neutro
3669,6/15/2022,el elon musk es un friki k m gusta,CigarroWassap,Positivo
3710,6/15/2022,Tesla’s Elon Musk no longer a $200 billion man | TESLARATI https://t.co/VO7k1fkU7T via ,michaelbathurst,Neutro
3728,6/15/2022,":maple_leaf  Elon Musk, el genio de la tecnología que trabaja sin descanso... https://t.co/WvTARo1Zx8""",genotipado,Positivo
3730,6/15/2022,"Mentira. Que estos mensajes no os adormezcan ni os atormenten. Podeis hacer mucho más, llegar más lejos.

Suena muy Mr. Wonderful, pero aquí no hablamos de cualidades innatas, NO hablamos de talento. No todos los que llegan lejos son Elon Musk.

Abro hilo. https://t.co/xfLPDmEl0V",ElCalvoDeLobat0,Positivo
3753,6/15/2022,"Los Azov no pudieron salir con ayuda de Elon Musk 
#AzovBattalion #RussianArmy https://t.co/EzlNZBjofh",carlosmontoy9,Negativo
3786,6/15/2022,#Tesla recortará parte de su plantilla de trabajadores y no aceptará el trabajo remoto https://t.co/2EPwxV8QbE+ #elonmusk #twitter #teletrabajo,Digital_Too,Negativo
3800,6/15/2022,Sabía que algo andaba mal con estas recomendaciones. Lo confirmé cuando puso el de Elon Musk https://t.co/RN5QrrWDhT,CesarAndreZzZ,Negativo
3814,6/15/2022,"AHORA  seedling | ""Son millonarios que viven desconectados de la realidad. Elon Musk es un hipócrita"", Walter Smolarek

 television  
 mobile_phone  https://t.co/6Qs2dvYqyD
#BrotesVerdes https://t.co/bhjVhwY3gj",aleberco,Negativo
3816,6/15/2022,"AHORA  seedling | ""El hecho de que Elon Musk hiciese chistes acerca de derrocar gobiernos, es un asco"", Walter Smolarek

 television  
 mobile_phone  https://t.co/6Qs2dvYqyD
#BrotesVerdes https://t.co/RyvsVIqKRY",aleberco,Negativo
3493,6/15/2022, bomb  Elon Musk abre el primer túnel subterráneo para aliviar el tráfico en Los Ángeles... https://t.co/yP5ATCfpTK,condebrocoli,Positivo
3494,6/15/2022,"Muchas veces la pobreza es fruto de malas decisiones que se tomaron por falta de información, educación; no porque Elon Musk o demás millonarios sean ricos.
De acuerdo contigo https://t.co/xYh2ATLjkN",freddyleonardo,Positivo
3501,6/15/2022, Elon musk después de irse a la quiebra,Lucas18111979,Negativo
3505,6/15/2022,"            Jajajajsjs, me encanta que Twitter esté haciendo limpieza de fachas!

Parece que la compra de Twitter por parte de Elon Musk, no os está yendo muy bien eh  face_with_tears_of_joy   rolling_on_the_floor_laughing ",DavidCastro889,Neutro
3508,6/15/2022,"  Apenas rico entre 2 y 3 palos gringos
Rico entre 5 y 10 palos verdes 
Super rico entre 10 y 20 palos
Mega rico arriba de 50 palos
BILLONARIO, lo dice el nombre.
Pero mi definición de alguien verdaderamente rico es el nivel Elon Musk",vendedor4x4,Positivo
3511,6/15/2022, Antidote====&gt; Elon Musk University  winking_face ,Frankd06830,Neutro
3513,6/15/2022,"  elon musk pago 44,000 millones por ver a juaan_kd hablar con jotauvele",NKUNKUnismo3,Positivo
3517,6/15/2022, si me dieran una moneda por la gente que bloquea dalas seria el mismísimo Elon musk,megas45654,Positivo
3523,6/15/2022,":maple_leaf  Elon Musk, el genio de la tecnología que trabaja sin descanso... https://t.co/QzWClYkei2""",Canal_Z_,Positivo
3524,6/15/2022,Elon Musk les hablará a los empleados de Twitter esta semana https://t.co/texcnyOfcn #Pisandolaraya #Dajabon #Noticias,pisandolaraya,Neutro
3531,6/15/2022," money_with_wings ¿Cuántos miles de millones de dólares perdieron Elon Musk, Jeff Bezos y Mark Zuckerberg en lo que va del 2022?

 backhand_index_pointing_right Jeff Bezos: 65.300 millones de dólares.

 backhand_index_pointing_right Mark Zuckerberg: 64.400 millones de dólares.

 backhand_index_pointing_right Elon Musk, 73.2 mil millones de dólares.

Business Insider https://t.co/01eLNpL7jB",juanpadeleo,Neutro
3532,6/15/2022,Elon Musk les hablará a los empleados de Twitter esta semana https://t.co/1FapcWhbcl,MegaDiarioRD,Neutro
3538,6/15/2022," Bill Gates pasó a ser un loquito cualquiera de la zona colonial, pero con mucho dinero.

Elon Musk lo tiene hablando con lo palo e lu",LetiC05,Neutro
3546,6/15/2022,"Si te sentis mal porque en este 2022 perdiste con las inversiones backhand_index_pointing_down 
Deberias tener en cuenta que casi todo el mundo también perdió, solo es un año dificil. Mira lo que perdieron los mas ricos de mundo money_with_wings 

Elon Musk: 73.200 mill
Jeff Bezos: 65.300 mill
Mark Zuckerberg: 64.400 mill",FedeAlonss,Neutro
3558,6/15/2022," Jajajajajajajajaja estas diciendo que Elon Musk seria un buen dirigente por su éxito empresarial? Enserio? Cuando entenderas que un territorio con diversidad de credos, culturas y lenguas no es una empresa que solo se enfoca en productividad, sino también en la parte humana?",Edgomaz,Negativo
3559,6/15/2022," Vamos a ver, cuando compras una participación de cualquier empresa es Ad eternum...hasta que cojas esa participación y la vendas. Elon  Musk si compra el 10% de TW...lo compra ad eternum hasta que lo venda...no entiendo donde esta el problema",ForeverBara2,Neutro
3562,6/15/2022,"Tesla Motors podría sufrir un recorte del 10% de su equipo de trabajo ante la posible recesión. Elon Musk lo advirtió y parece que está cumpliendo  grinning_face_with_sweat 
https://t.co/rtBduezGcc",fayerwayer,Neutro
3564,6/15/2022,Elon Musk asegura que 'Starship' estará lista para su vuelo en julio https://t.co/4UegqEvj5K,FDJenSport,Neutro
3570,6/15/2022,“El dueño de Tesla aseguró que «una plataforma no puede considerarse inclusiva o justa si está sesgada contra la mitad del país»” https://t.co/yk5piIctB6 #Tecnología  United_States  por ,PanAmPost_es,Neutro
3573,6/15/2022,"La Base Estelar de la playa de Boca Chica, en Texas, ha levantado polémica estos últimos meses, en especial por el impacto ambiental que supone, así que la compañía de Elon Musk planea un traslado de la nave estelar al Centro Espacial Kennedy de la NASA. https://t.co/eZ5p1wE3LB",NatGeoEspana,Neutro
3588,6/15/2022, Yo digo que ese Elon musk namás nos está quitando el líquido de las rodillas.,Santiag65156374,Negativo
3592,6/15/2022,seguro q la pueden hace pero no lo hacen pa vender mas aires acondicionaos elon musk https://t.co/ITvs7JIEk4,fullerofullerx,Neutro
3491,6/15/2022,"Va a ser una larga reunión, con cientos de preguntas de los trabajadores de la empresa  smiling_face_with_sunglasses 
https://t.co/flJe8FIBX9",fayerwayer,Neutro
3498,6/15/2022," Imagínate yo con vértigo, no subo ahí ni aunque me den la fortuna de Elon musk xD",Aitor___02,Positivo
3526,6/15/2022,". multimillonario señalado próximo 
Mente maestra d 
“Dije a mis padres q iba a ser algo q solo haría en verano. Nunca + volví a la escuela” para revolucionar la industria d la inteligencia artificial https://t.co/Sg3DCWc1xH",MikeBoloboski,Positivo
3551,6/15/2022,"El multimillonario y CEO de Tesla, Elon Musk, dijo que se inclina por votar por el gobernador republicano de Florida, Ron DeSantis, en las elecciones presidenciales de 2024.  https://t.co/KhaOzW4ANp",TampaHoy,Neutro
3595,6/15/2022,"Elon Musk tiene un ""mal presentimiento:y quiere reducir empleos en Tesla https://t.co/tGlYMBW7yt vía  ",melany96477799,Neutro
3601,6/15/2022,elon musk leyendo los tweets de dalas: https://t.co/HVU9NQlY1F,fentyblond,Neutro
3605,6/15/2022,"    Pues deberías investigar más, Elon Musk hizo él solo su fortuna, fundó PayPal la vendió de ahí comenzó su crecimiento, lo mismo con Jeff Bezzos",fdelgado87,Positivo
3618,6/15/2022,  ¿¿¿¿¿Dónde se compra esa mierda????? Me da igual si tengo que ir al futuro o venderle mi alma a Elon Musk pa encontrarlo,jolma02,Positivo
3624,6/15/2022,"Sr. Elon Musk, me vas a quitar la cuenta por subir clips musicales?eh?eh?eh? No, verdad? Si soy un who grimacing_face 
NO, POR FAVOR  folded_hands ",SoCreux,Neutro
3635,6/15/2022,Elon musk e viado,chapadaodenoia,Neutro
3638,6/15/2022,"  Pero el intento de estadista de zipaquira piensa que tendra 12 años de colchon. Elon musk pidio el aumento de la produccion de petroleo sabe porque? La movilidad renovable puede tardar hasta 20 años, la transicion y la tecnologia aun es muy limitada.",CryptoGr4phic,Neutro
3640,6/15/2022, ELON MUSK VDD,mitsuyazito,Positivo
3642,6/15/2022,La verdadera historia de Elon Musk antes de ser multimillonario https://t.co/CS9SZVuIng,EmpHistorias,Positivo
3643,6/15/2022,Se acuerdan cuando el elon musk dijo algo del doge coin y luego se fue a la verga? O que pasó o que?,skromulo,Negativo
3649,6/15/2022,  Yo estoy convencido que le dices que Elon Musk está a punto de conseguirlo y se lo cree.,NomadaJaime,Neutro
3651,6/15/2022," Eso es lo que veo y peor aún con el respaldo de Elon Musk, verdadero:influencer”, para bien y para mal, que hará que se incline la balanza para quien él decida…qué por cierto, la prensa sugiere que será a Ron DeSantis… lo de la compra de Twitter no es un capricho…",ajsolorzano,Negativo
3658,6/15/2022," Nah, ahora llegará Elon Musk y dira ""RATIO:y la gente le seguirá porque ""es el new rich:de moda. Los chads...",MarcosGinel,Negativo
3668,6/15/2022,Elon Musk escucha audiencia en Twitter https://t.co/JTVQcPMGv9,LaCriptomoneda1,Neutro
3679,6/15/2022,":maple_leaf  Elon Musk, el genio de la tecnología que trabaja sin descanso... https://t.co/oCdFezUUkl""",RadioCorp51,Positivo
3694,6/15/2022,&gt;&gt;Elon Musk cuestiona el continuo y evidente sesgo ideológico de Twitter https://t.co/4ub9SPGS1I,tristan52530,Neutro
3512,6/15/2022,"Hasta el principito tiene una cuenta en Twitter
Y elon musk no quiere comprar tuiter?  rolling_on_the_floor_laughing  face_with_tears_of_joy  rolling_on_the_floor_laughing  face_with_tears_of_joy ",FFermansu,Neutro
3529,6/15/2022,Elon Musk da su primer voto a los republicanos y vaticina su apoyo a DeSantis para las presidenciales del 2024 https://t.co/aCplScdeLg #Noticias https://t.co/YUfyWh8nO7,ElAmerican_,Neutro
3530,6/15/2022,Elon Musk les hablará a los empleados de Twitter esta semana (Por el Ojo de la Cerradura - Periódico Digital Dominicano) - https://t.co/VZTCCB4Jxh https://t.co/VBQMpm32VP,porojocerradura,Neutro
3537,6/15/2022,"Si me dieran un dólar por cada segundo que pienso en ti ......
Ahorita mismo tendría a elon musk planchando mi ropa  y a Jeff bezos sacando la basura  rolling_on_the_floor_laughing ",chavizaaaA,Neutro
3549,6/15/2022,"Fortunas Bajo Presión: Elon Musk, Jeff Bezos Y Mark Zuckerberg Pierden Miles De Millones De Dólares Notidigital RD https://t.co/QMAi6qVhdk https://t.co/tAwfEZ1Jea",notidigitalrd1,Neutro
3583,6/15/2022,Elon Musk acaba de publicar que se inclina a votar (y apoyar) al gobernador de Florida  en las elecciones presidenciales del 2024.,EmmaRincon,Neutro
3585,6/15/2022, Famoso Elon musk,Gustavo60364001,Positivo
3593,6/15/2022,"   Centrarte en que un 1% es más rico, es más envidia, que otra cosa. De hecho, Elon Musk ya ofreció un buen pellizco de su fortuna, la cantidad que le dijeron que era suficiente para acabar con el hambre en el mundo, si le presentaban el plan para hacerlo realidad. Sigue esperando.",badgarblak,Positivo
3603,6/15/2022, bomb  Elon Musk abre el primer túnel subterráneo para aliviar el tráfico en Los Ángeles... https://t.co/K570FcTwP4,Esto_marcha,Positivo
3609,6/15/2022,Elon musk comprate instagram y arreglalo que anda como el orrrto,Ivaansuarez_,Positivo
3610,6/15/2022,"Fortunas bajo presión: cuántos miles de millones de dólares perdieron Elon Musk, Jeff Bezos y Mark Zuckerberg en lo que va del año https://t.co/WLnFn7iPmR",infobaeamerica,Negativo
3627,6/15/2022,"“Musk sigue de cerca el tema de la censura, de hecho uno de las primeras afirmaciones que hizo cuando dio a conocer la oferta de comprar es garantizar una verdadera libertad de expresión” https://t.co/yk5piIctB6 #Tecnología  United_States   por ",PanAmPost_es,Positivo
3634,6/15/2022,Ya no le hacéis la pelota a Elon Musk?,BonitaMilana_,Negativo
3644,6/15/2022,"  Él ya ha dicho en repetidas ocasiones que no va a ser él personalmente quien lo haga, porque es imposible. Es como si dijeras que fue Elon Musk quien consiguió todos sus avances. No, él va a ser la cara visible y quien dirija al grupo, pero no va a ser el científico.",Vladar41581167,Negativo
3647,6/15/2022,"EL IMPACTANTE REGALO de 80.000$ que le Hizo ELON MUSK a AMBER HEARD! https://t.co/wAwbrKMBJ5 a través de  Y encima, se quedó embarazada del hombre más rico del mundo... Esta satánica mujer.",LaHoraAzul3,Neutro
3654,6/15/2022,"En 2020, Twitter tomó acciones contra 1,1 millones de cuentas por infringir su política contra conductas de odio. Todo dice que el concepto de libertad de expresión en Twitter cambiará con la llegada de Elon Musk: https://t.co/SNWTFS0PUd #DiplomadoMarketingDigital #UC https://t.co/qaJlOJQErb",clase_ejecutiva,Neutro
3663,6/15/2022," .
¿Sabias que Elon Musk está vendiendo pasajes de ida a Marte? No necesitas visa para instalarte y tal vez haya algun marcianito que te dé laburo. Nunca se sabe ¿no? Una mas ¿Sabes de la inauguracion del Martin Salwe Haters Club? Ni tu viejo te salva!!! Jajajaja",doberhoocom,Negativo
3497,6/15/2022, Aparecen los hamilovers llorando y criticando ( muchos con imágenes en lugar de fotos)  face_with_rolling_eyes  espero Elon Musk compré Twitter y desaparezcan esos fantasmas,MathFer99,Neutro
3503,6/15/2022, collision  El Hyperloop de Elon Musk es posible. ¿Qué tanto lo queremos? https://t.co/pF0fAPbsZL,Tuitores,Neutro
3556,6/15/2022,Que ganas de ser Elon musk y comprarme la cervecería hondureña para solo fabricar la Imperial  loudly_crying_face  loudly_crying_face  loudly_crying_face  loudly_crying_face ,QuirozSkarleth,Neutro
3611,6/15/2022,"El #Starship (el cohete que parece nave de Flash Gordon) de  podría realizar su primer vuelo el mes que entra.
El propio Elon Musk lo anunció en su cuenta de Twitter. https://t.co/RDo4bS1Ao3",areygadas,Neutro
3666,6/15/2022,  Space X? Eso quiere decir que van a trabajar para Elon Musk https://t.co/CimBk8mD6O,GzmGzmanpelao,Neutro
3674,6/15/2022," bear  #Musk ha advertido en múltiples instancias sobre un inminente colapso de la población. Advirtió que, si no se detiene la disminución de la población en Japón, el país pronto desaparecerá. ¿Es un outsider en lo referente al #controlpoblacional?  down_arrow  
https://t.co/NbXho8AiUO",elosoblindado,Neutro
3680,6/15/2022," Si Elon Musk,Saylor y demás no vendieron en 69000 por algo será,largo plazo.",pep46900429,Neutro
3682,6/15/2022,RECORDAR NIÑES QUE ESTA SERIE DE HOSTIAS COMENZO CUANDO ELON MUSK SALIO EN SNL VESTIDO DE WARIO,Miguel_G_A,Negativo
3687,6/15/2022,"El operador más grande en términos de colocación de satélites en todo el mundo es SpaceX del multimillonario de Tesla Elon Musk, que a través de su sistema SpaceLink tiene como objetivo brindar acceso a Internet a todo el mundo, objetivo importante para la ONU y el WEF.",LOQUEDIGAELFMI,Neutro
3689,6/15/2022,  Elon Musk viendo que ha pagado 43 mil salmones para encontrarse estas mierdas https://t.co/7hi35eXQbg,pablolasen,Negativo
3695,6/15/2022,Elon Musk pagó 44 salmones para que yo no esboce ni la más ligera sonrisa https://t.co/LlciuUWMnA,f1anderpri,Neutro
3704,6/15/2022,  Elon musk basado,deivissvr,Positivo
3706,6/15/2022," Según Elon Musk es 20, lo dijo hace un año en un tweet, no va muy desencaminado.",TheCryptoLemon,Positivo
3709,6/15/2022, comet   El Hyperloop de Elon Musk es posible. ¿Qué tanto lo queremos? https://t.co/X1QPre4kwO,LaPublicacion,Positivo
3820,6/15/2022,Tt de Elon Musk https://t.co/hDGlfgLXM9,SeixasIsaac,Neutro
3843,6/15/2022,ya te vi mi perro elon musk con tus satélites en el cielo ya te dije q no voy a contestar eso q me mandaste,Raul7orres,Neutro
3845,6/15/2022,   Elon Musk es inimputable... Ya está en el olimpo de los genios. Jugar con los mercados es solo un hobby para él. En todo caso él apenas sería uno más de los manipuladores... El que se quema que se joda,ariza_will,Positivo
3849,6/15/2022, bomb  Elon Musk abre el primer túnel subterráneo para aliviar el tráfico en Los Ángeles... https://t.co/xBmn0nbONL,puertappal,Neutro
3868,6/15/2022,   O elon musk ta vivo...,SrCiclone,Neutro
3873,6/15/2022,"“En desacuerdo con la respuesta” eso y poner:soy una Mabel” era lo mismo, borre eso Elon Musk (?) renuncie https://t.co/0GlYfYl3tB",_Chucara,Negativo
3878,6/15/2022,"Comenta el inquilino del palacio que Elon Musk le está apostando erróneamente a los coches eléctricos, ¿Que harán cuando no haya luz?",Rascacolas,Negativo
3882,6/15/2022,Te amo Elon musk  heart_on_fire  https://t.co/uZQqcRwK9Y,sanabria160,Positivo
3885,6/15/2022,Cómo Elon Musk está revolucionando un rincón en la frontera de EE.UU. y México (y los contradictorios efectos que provoca) https://t.co/k46Uk6CRRX,Yahoo_Finanzas,Neutro
3888,6/15/2022,"Me sorprende que cierta gente no entienda el fanatismo por Elon Musk. Es lo mismo de siempre, es un genio en un rubro y en todo lo demás una mezcla de cringe e ignorancia brutal. Como todos los famosos o artistas en general que muchos toman de voceros en política o economía.",nehuenm,Neutro
3890,6/15/2022," bueno, al parecer a Elon Musk le encanta bancarme",Fabiluchi__,Positivo
3891,6/15/2022,  Elon Musk cagándose de risa...  smiling_face_with_sunglasses ,floyd2501,Positivo
3899,6/15/2022,"    Bueno habla el intelectual del siglo XXI de Twitter.
Saludos Elon Musk criollo.",aguaaceite,Positivo
3908,6/15/2022,  El logaritmo jaksjajjaja se ponia a hacer funciones exponenciales elon musk,roman_juez,Neutro
3915,6/15/2022,De nuestras redes - El níquel para los coches eléctricos sale de la selva de Indonesia: carta a Elon Musk https://t.co/9HiTry37b0 a través de ,luiscaceresr,Neutro
3927,6/14/2022, Si lo ves como una referencia a Elon Musk es hasta satisfactorio.,Anarchy_ChipsV2,Positivo
3939,6/14/2022,Elon Musk analiza abrir nueva fábrica de Tesla en la República Mexicana https://t.co/7NbicY6lkB,Revolucion3_0,Positivo
3944,6/14/2022,A guria defendendo Elon Musk na aula sobre teorias de Marx  face_with_rolling_eyes ,flavi_godinho,Neutro
3948,6/14/2022,Elon Musk inició despidos masivos en Tesla y comenzó por un gerente https://t.co/hK9NMevTJX,ElNacionalWeb,Negativo
3956,6/14/2022,  Ni elon musk tiene esta tecnología tan avanzada  face_with_tears_of_joy ,Hpmagic25,Neutro
3823,6/15/2022," Bueno, acá tenemos una propuesta de mejora Elon, una función que advierta al resto  raising_hands_medium_skin_tone  sparkles 
Espero que me lea sr Musk, soy un gran fan victory_hand_medium-dark_skin_tone ",manuchomuchacho,Positivo
3839,6/15/2022,elon musk derruba essa conta https://t.co/AoE8hdelxv,inodted,Neutro
3844,6/15/2022,Elon Musk prefeito de Ratanabá,nataliastazka,Neutro
3856,6/15/2022,"El CEO de Tesla, Elon Musk, acaba de dejar el club más exclusivo del mundo. 
En medio de las presiones del mercado actual, el patrimonio neto de Musk se encuentra actualmente en $197 mil millones, una disminución de $11,9 mil millones desde el 12 de junio. https://t.co/s7vKRGyRK7",juanalachama,Neutro
3884,6/15/2022,"La situación ocurrió en España, en el que el automóvil de la empresa de Elon Musk presentaba varios aspectos que no dejaron conforme al hombre.https://t.co/GEuz7l6ayr",MilenioTam,Negativo
3918,6/15/2022,"No busquéis
No busquéis en Google ""Elon Musk edad:https://t.co/SHOHvooyOa",filmestock,Negativo
3923,6/14/2022," globe_showing_Americas #Mundo | Elon #Musk hablará con empleados de #Twitter por primera vez.
https://t.co/nCSAagy0Qw https://t.co/S2tD1Ii0CV",Ideopolismx1,Neutro
3951,6/14/2022,"Lo mismo pasa con los ultra fans de Tony Khan, Elon Musk, etc.",diegokike94,Neutro
3961,6/14/2022,Lol me acabo de dar cuenta que Elon Musk sale en Iron Man 2,franjjh__,Neutro
3966,6/14/2022,Mañana despertaré asi y dejare de ser un NPC. Elon Musk no leas esto. https://t.co/l9LxYVaD6y,Ardurum_kebab,Neutro
3972,6/14/2022,Maldito elon musk con toda esa plata que tiene puede es alimentar a toda Africa,Mdavo09,Negativo
3976,6/14/2022, que genio de elon musk,ArielLarzen,Positivo
3979,6/14/2022,"    Hay glaciares, no sé si está dentro de los planes de elon musk poder derretirlos de alguna manera 

Pero ahí están",slimebicito,Negativo
3983,6/14/2022,"Elon Musk, trad: El león mosca",__landaburu,Negativo
